Product Name,Category,Price,Rating,Reviews_Text,No_of_Reviews
jiyamobility SUPER SPLENDOR/GLAMOUR / GLAMOUR FI MOLDED Clutch Plate,Clutch,₹275,,,0
KDTRD Clutch Brake Paddle Rubber Cover Pad Creta i20 Elite /Verna Fluidic Car Pedal Clutch Plate,Clutch,₹125,,,0
Digital Craft CT 100 Clutch Plate,Clutch,₹282,2.5,(4),4
Jagdamba Motorss Clutch Plate Clutch Plate,Clutch,₹171,,,0
MOTO PLANET 02CD0080 Clutch Plate,Clutch,"₹1,443",5,(5),5
MOTO PLANET MPD-Bike Clutch Plate Set (7-Plate Kit) for K-390-High-Performance Clutch Kit Clutch Plate,Clutch,₹656,,,0
THE ONE CUSTOM HODIBABA CLUTCH PLATES Bike Clutch Cover,Clutch,₹342,,,0
road religion Genuine Clutch Plate Set compatible with Yamaha RX100 (Genuine - 5 pcs) Clutch Plate,Clutch,₹487,4.1,(19),19
road religion Clutch Oil Seal with Plate for Bullet 350cc Motorcycles Clutch Plate,Clutch,₹247,,,0
MOTO PLANET MPD-Clutch Plate Set Of 6 for Duke 200-High-Grip Friction Disc-Smooth Engagement Clutch Plate,Clutch,₹623,,,0
Digital Craft RX-100 Clutch Plate,Clutch,₹662,3,(4),4
Digital Craft Dazzler High Quality Clutch Plate [ Pack of 5 ] Clutch Plate,Clutch,₹689,3.5,(4),4
Digital Craft CRUX Clutch Plate,Clutch,₹287,4.8,(5),5
Digital Craft Duke 200 Clutch Plate,Clutch,₹642,3.7,(33),33
road religion Clutch Plate Set compatible with FZ-16 - 04 pieces Clutch Plate,Clutch,₹412,3,(4),4
Road Relgion Genuine Boss Clutch With Pressure Plate compatible with RX100 Clutch Plate,Clutch,"₹1,172",,,0
"Road Relgion Boss Clutch, Pressure Plate, Steel Plates (4 Pcs) & Clutch Plates (5 Pcs) Clutch Plate",Clutch,"₹2,263",,,0
road religion Clutch Plate Set for RE Standard 350 and Classic 350 (Gold) - 06 pieces Clutch Plate,Clutch,"₹1,422",3.8,(6),6
Digital Craft FZ-S Clutch Plate,Clutch,₹470,3.8,(4),4
road religion Steel Plate Set compatible with Yamaha RX100 (04 Pieces) Clutch Plate,Clutch,₹372,4.7,(6),6
Digital Craft Splendor I-Smart Clutch Plate,Clutch,₹430,3.4,(7),7
road religion Genuine Clutch Plate Set compatible with CRUX/ENTICER/YBX/YBR (Genuine - 5 pcs) Clutch Plate,Clutch,₹533,3.1,(10),10
Pa Commando One Way Clutch Roller Clutch Plate,Clutch,"₹1,386",4.5,(2),2
Digital Craft CD Dawn Clutch Plate,Clutch,₹467,,,0
Pa RX100 STEEL PLATE Clutch Plate,Clutch,₹383,3.2,(5),5
Digital Craft FZ Clutch Plate,Clutch,₹403,3.8,(13),13
Digital Craft Centuro Rockstar Clutch Plate,Clutch,₹636,,,0
Digital Craft RC390 Clutch Plate,Clutch,₹770,4.3,(4),4
Pa RX135 CLUTCH PLATE Clutch Plate,Clutch,₹555,4.5,(11),11
Chinkraft FZ16 V1 Clutch Plate Kit (4 Pieces) Clutch Plate,Clutch,₹498,,,0
Chinkraft R15 V1 Clutch Plate Set (5 Pieces) Clutch Plate,Clutch,₹498,,,0
Digital Craft FZ 25 Clutch Assembly Clutch Plate,Clutch,"₹2,492",4,(3),3
SUPRAJIT CLUTCH PLATE CALIBER OIL DIP Clutch Plate,Clutch,₹200,,,0
GARGOVERSEAS Two Wheeler Bike Honda Shine Clucth Plate Set of 4Pcs Clutch Plate,Clutch,₹215,3.7,(9),9
MOTO PLANET MOTO-02CD0070 Clutch Plate,Clutch,"₹1,767",,,0
Digital Craft Discover 135 Clutch Plate,Clutch,₹591,2.3,(4),4
Digital Craft XCD 125 Clutch Plate,Clutch,₹311,2.3,(3),3
Digital Craft Dream yuga Clutch Plate,Clutch,₹329,,,0
road religion Clutch Plate Set compatible with R15 V1 - 05 pieces Clutch Plate,Clutch,"₹1,244",3.3,(3),3
Digital Craft DUKE390 Clutch Plate,Clutch,₹695,4,(5),5
GEO Brake Disc Plate Compatible for Bajaj Pulsar NS 200 Front Brake Disc,Clutch,₹690,3.9,(10),10
ONESTOP hgb Bike Clutch Cover,Clutch,"₹1,160",,,0
RNG PVT LTD Activa 110 Clutch Plate,Clutch,₹418,,,0
Digital Craft DUKE 125 Clutch Plate,Clutch,₹731,2.9,(11),11
KT Global BIke Clutch Plate Compatible for Radeon Clutch Plate,Clutch,₹498,,,0
Digital Craft UNICORN Clutch Assembly Clutch Plate,Clutch,"₹1,648",,,0
GEO Brake Disc Plate Compatible for Bajaj Pulsar 150/180 Front Brake Disc,Clutch,₹650,3.7,(42),42
TRP Traders REAR BRAKE DISC PLATE - P ULSAR 200 NS / 200 RS Motorbike Brake Disc,Clutch,₹666,4.1,(105),105
Digital Craft Dream Neo Clutch Plate,Clutch,₹419,,,0
Digital Craft Platina Comfortec Clutch Plate,Clutch,₹488,,,0
GEO Brake Disc Plate Compatible for Bajaj Pulsar 150 Twin Disc BS6 Motorbike Brake Disc,Clutch,₹597,4,(4),4
GEO Brake Disc Plate Compatible for Bajaj Pulsar F250 Front Brake Disc,Clutch,"₹1,272",,,0
Digital Craft CD-100 Clutch Plate,Clutch,₹491,,,0
Pa NS200 /RS200 /Dominor 400 One Way Clutch Roller Clutch Plate,Clutch,₹689,,,0
Pa RD 350 Clutch Plate,Clutch,"₹1,450",,,0
Pa Super Meteor 350 One Way Clutch Roller Clutch Plate,Clutch,"₹1,655",,,0
GEO SAR S REAR Brake Disc,Clutch,₹726,3.2,(5),5
GEO Brake Disc Plate Compatible for Bajaj Pulsar Pulsar 200/220 Front ABS UG5 Brake Disc,Clutch,₹892,5,(4),4
Digital Craft Centuro Clutch Plate,Clutch,₹373,4.6,(5),5
Digital Craft Platina Clutch Plate,Clutch,₹579,,,0
GEO BAJAJ PLATINA 110 REAR Brake Disc,Clutch,₹684,,,0
GEO Brake Disc Plate Compatible for Bajaj Pulsar AS Front Brake Disc,Clutch,₹748,,,0
ALLEXTREME MK Clutch Plate Set Clutch Plate,Clutch,₹752,4.1,(14),14
VDV W2WR Clutch Plate,Clutch,₹751,,,0
Digital Craft Discover 100 Clutch Plate,Clutch,₹465,2.7,(3),3
Digital Craft RC 125 Clutch Plate,Clutch,₹864,2.2,(6),6
GEO Disc Plate Compatible with UM Renegade Commando/UM Renegade Sports S/UM Renegade Classic/UM Renegade Mojave Motorbike Brake Disc,Clutch,"₹1,537",,,0
GEO UNICORN Brake Disc,Clutch,₹880,,,0
Pratham auto care Bike Clutch Plate Kit for Y_ FZ Clutch Plate,Clutch,₹522,,,0
pas S2026P01 Clutch Plate,Clutch,₹428,,,0
GEO Rear Brake Disc Plates Compatible for Hero Glamour Models (Rear) Brake Disc,Clutch,₹938,,,0
PHANTOM Aluminum Brake Clutch Lever Protector Guard For Universal Bikes Fit Handlebar Hand Guard,Clutch,"₹1,711",,,0
Pa Clutch Rocket Roller Set For Activa New Models Clutch Plate,Clutch,₹724,5,(3),3
Pa Ntorq 125 One Way Clutch Roller Clutch Plate,Clutch,₹458,4,(10),10
KT Global Clutch Plate Compatible for SZ. Clutch Plate,Clutch,₹400,,,0
KT Global Clutch Plate Compatible for CRUX-R. Clutch Plate,Clutch,₹401,,,0
GEO Brake Disc Plate Compatible for Bajaj Platina 11O Brake Disc,Clutch,₹849,2.3,(3),3
GEO Front Brake Disc Plate Compatible With KTM 200/ RC 280MM Brake Disc,Clutch,₹778,2,(4),4
Digital Craft Super Splendor Clutch Plate,Clutch,₹555,,,0
Digital Craft Stunner Clutch Plate,Clutch,₹575,,,0
GEO Brake Disc Plate Compatible for Bajaj Pulsar NS 200 Front Brake Disc,Clutch,₹690,3.9,(10),10
ONESTOP hgb Bike Clutch Cover,Clutch,"₹1,160",,,0
KT Global Clutch Plate Compatible for FAZER. Clutch Plate,Clutch,₹436,,,0
Pa Shine CLUTCH PLATE Clutch Plate,Clutch,₹500,,,0
Digital Craft R15 Clutch Assembly Clutch Plate,Clutch,"₹2,404",3.3,(3),3
SAM Cluch plate m80/m50 Clutch Plate,Clutch,₹464,4.3,(3),3
GEO Brake Disc Plate Compatible for Bajaj Pulsar 150/180 Front Brake Disc,Clutch,₹650,3.7,(42),42
TRP Traders REAR BRAKE DISC PLATE - P ULSAR 200 NS / 200 RS Motorbike Brake Disc,Clutch,₹666,4.1,(105),105
KT Global Bike Clutch Plate Compatible for DAZZLER. Clutch Plate,Clutch,₹476,,,0
Pa Rocket Roller Set For Activa New Models Clutch Plate,Clutch,₹537,3.8,(35),35
GEO Brake Disc Plate Compatible for Bajaj Pulsar 150 Twin Disc BS6 Motorbike Brake Disc,Clutch,₹597,4,(4),4
GEO Brake Disc Plate Compatible for Bajaj Pulsar F250 Front Brake Disc,Clutch,"₹1,272",,,0
Digital Craft Avenger 220 Clutch Plate,Clutch,₹644,2,(4),4
KS ENTERPRISES Pressure Plate Set compatible with RX100 RXZ RX135(04 Pieces) Bike Clutch Cover,Clutch,₹351,,,0
"road religion Boss Clutch, Pressure Plate, Steel Plates (4 Pcs) & Clutch Plates (5 Pcs) Bike Clutch Cover",Clutch,"₹2,199",,,0
Mytriauto Clutch Plate Cover Assembly Clutch Plate,Clutch,"₹3,398",,,0
GEO SAR S REAR Brake Disc,Clutch,₹726,3.2,(5),5
GEO Brake Disc Plate Compatible for Bajaj Pulsar Pulsar 200/220 Front ABS UG5 Brake Disc,Clutch,₹892,5,(4),4
Digital Craft R15 V2 Clutch Plate,Clutch,₹538,4,(12),12
RNG PVT LTD 33g Clutch Plate,Clutch,₹445,,,0
GEO BAJAJ PLATINA 110 REAR Brake Disc,Clutch,₹684,,,0
GEO Brake Disc Plate Compatible for Bajaj Pulsar AS Front Brake Disc,Clutch,₹748,,,0
Digital Craft Shine Clutch Plate,Clutch,₹567,,,0
Digital Craft Passion X Pro Chain Sprocket Kit With Clutch Plate Clutch Plate,Clutch,"₹2,008",,,0
Digital Craft R15 Clutch Plate,Clutch,₹707,4,(3),3
Digital Craft FAZER Clutch Plate,Clutch,₹453,4,(4),4
GEO Disc Plate Compatible with UM Renegade Commando/UM Renegade Sports S/UM Renegade Classic/UM Renegade Mojave Motorbike Brake Disc,Clutch,"₹1,537",,,0
PHANTOM Aluminum Brake Clutch Lever Protector Guard For Universal Bikes Fit Handlebar Hand Guard,Clutch,"₹1,711",,,0
Digital Craft Shine SP Clutch Plate,Clutch,₹548,2.8,(4),4
"Gogna Mart Brake Clutch Lever, Adjustable Brake Clutch Control , ladakh flag bike Bike Fairing Kit",Clutch,"₹1,244",,,0
GEO UNICORN Brake Disc,Clutch,₹880,,,0
GEO Rear Brake Disc Plates Compatible for Hero Glamour Models (Rear) Brake Disc,Clutch,₹938,,,0
Paanjo Universal Clutch Center guide Alignment Tools Clutch Plate,Clutch,₹621,3.6,(141),141
Tools India 4 PIN Heavy Clutch Holder For Bike Vehicle Tool Kit,Clutch,₹135,3.9,(9),9
Digital Craft SZ RR Clutch Plate,Clutch,₹403,,,0
Digital Craft SZ Clutch Plate,Clutch,₹373,,,0
GEO Brake Disc Plate Compatible for Bajaj Platina 11O Brake Disc,Clutch,₹849,2.3,(3),3
GEO Front Brake Disc Plate Compatible With KTM 200/ RC 280MM Brake Disc,Clutch,₹778,2,(4),4
harison FRONT DISC PLATE COMPATIBLE FRO ACTIVA 125 Motorbike Brake Disc,Clutch,₹734,,,0
MT Enterprises K-10 Car Ac compressor Clutch Plate Only Car A/C Control Unit,Clutch,₹866,,,0
GEO Brake Disc Plate Compatible for Bajaj Pulsar NS 200 Front Brake Disc,Clutch,₹690,3.9,(10),10
ONESTOP hgb Bike Clutch Cover,Clutch,"₹1,160",,,0
"harison CLUTCH WEIGHT C TOO, PLATINA KICK START OLD MODEL Clutch Plate",Clutch,₹760,,,0
Chinkraft R15 V1 Clutch Plate Set (5 Pieces) Clutch Plate,Clutch,₹498,,,0
KT Global Clutch Plate Compatible for FAZER. Clutch Plate,Clutch,₹436,,,0
Vtrust Front Brake Disc Plate Compatible for Bullet/Thunderbird /Classic Model Motorbike Brake Disc,Clutch,₹830,4.1,(28),28
GEO Brake Disc Plate Compatible for Bajaj Pulsar 150/180 Front Brake Disc,Clutch,₹650,3.7,(42),42
TRP Traders REAR BRAKE DISC PLATE - P ULSAR 200 NS / 200 RS Motorbike Brake Disc,Clutch,₹666,4.1,(105),105
Pa Shine CLUTCH PLATE Clutch Plate,Clutch,₹500,,,0
TRP Traders REAR Brake Disc Plates Compatible for Ola Electric Scooter Motorbike Brake Disc,Clutch,₹630,4.5,(37),37
GEO Brake Disc Plate Compatible for Bajaj Pulsar 150 Twin Disc BS6 Motorbike Brake Disc,Clutch,₹597,4,(4),4
GEO Brake Disc Plate Compatible for Bajaj Pulsar F250 Front Brake Disc,Clutch,"₹1,272",,,0
SHIVTRADRE Fuel Transfer Pump Kit Sucker Latest High Flow Hand Pump Portable Car Fuel Pump Brake Vacuum Pump,Clutch,₹137,3.9,(11),11
Digital Craft RX-100 Clutch Plate,Clutch,₹662,3,(4),4
ARS Shine Universal Hydraulic Gas Lift Cylinder for Office Chair Height Replacement ABS Hydraulic Unit,Clutch,₹357,,,0
"VKHAS Front Disc Brake Plate Unicon, Shine, Xtreme 125, Passion Heavy Duty Motorbike Brake Disc",Clutch,₹577,4.4,(8),8
GEO SAR S REAR Brake Disc,Clutch,₹726,3.2,(5),5
GEO Brake Disc Plate Compatible for Bajaj Pulsar Pulsar 200/220 Front ABS UG5 Brake Disc,Clutch,₹892,5,(4),4
Vtrust Front Brake Disc Plate Compatible For Bajaj Pulsar 200N Motorbike Brake Disc,Clutch,₹782,4.2,(18),18
Lvz Rear brake disc plate suitable for all ola ev Motorbike Brake Disc,Clutch,₹728,,,0
GEO BAJAJ PLATINA 110 REAR Brake Disc,Clutch,₹684,,,0
GEO Brake Disc Plate Compatible for Bajaj Pulsar AS Front Brake Disc,Clutch,₹748,,,0
TRP Traders Front Brake Caliper Assembly Compatible for Honda Shine/CB Shine Brake Caliper,Clutch,₹783,4.9,(8),8
"Vtrust Rear Brake Disc Plate Compatible for Hunter350, Meteor350 Motorbike Brake Disc",Clutch,₹903,4,(3),3
AOWBIKES OLA S1 REAR/BACK DISC PLATE Motorbike Brake Disc,Clutch,₹799,4.3,(59),59
Vtrust Rear Brake Pump Assembly Rear Master Cylinder Brake Pump for Classic 350cc 500cc Brake Caliper,Clutch,₹736,,,0
PHANTOM Aluminum Brake Clutch Lever Protector Guard For Universal Bikes Fit Handlebar Hand Guard,Clutch,"₹1,711",,,0
GEO Disc Plate Compatible with UM Renegade Commando/UM Renegade Sports S/UM Renegade Classic/UM Renegade Mojave Motorbike Brake Disc,Clutch,"₹1,537",,,0
Pa Ather Front Disc Plate Brake Disc,Clutch,₹734,3.8,(25),25
Mr and son's India Clutch Lever For Hero CBZ Extreme,Clutch,₹198,,,0
GEO UNICORN Brake Disc,Clutch,₹880,,,0
GEO Rear Brake Disc Plates Compatible for Hero Glamour Models (Rear) Brake Disc,Clutch,₹938,,,0
"TRP Traders Front Brake Disc Plate Compatible for Passion Pro, Shin 125 Motorbike Brake Disc",Clutch,₹574,4.1,(166),166
D'Mega Mart clutch cable adjustment Rx 100 135 worm gear kit Clutch Release Fork,Clutch,₹285,3.7,(3),3
"VKHAS Front Disc Break Plate For Apache RTR 160, 180, 200 2v/4v Motorbike Brake Disc",Clutch,₹658,4,(12),12
ojenda TVS Ronin Brake pads front and rear Vehicle Disc Pad,Clutch,₹269,3.3,(3),3
GEO Brake Disc Plate Compatible for Bajaj Platina 11O Brake Disc,Clutch,₹849,2.3,(3),3
GEO Front Brake Disc Plate Compatible With KTM 200/ RC 280MM Brake Disc,Clutch,₹778,2,(4),4
MILACHIN Rear Rack Plate for Himalayan Motorbike Brake Disc,Clutch,₹592,4.5,(6),6
Digital Craft 1.8 CFM Single Stage Vacuum Pump 1/4HP for AC HVAC Service Brake Vacuum Pump,Clutch,"₹5,857",,,0
GEO Brake Disc Plate Compatible for Bajaj Pulsar NS 200 Front Brake Disc,Clutch,₹690,3.9,(10),10
ONESTOP hgb Bike Clutch Cover,Clutch,"₹1,160",,,0
"VKHAS Front Disc Break Plate Apache RTR 160, 180, 200 2v/4v Motorbike Brake Disc",Clutch,₹692,4.8,(4),4
GALAXY MOTOR PRODUCTS OVERSIZED CALIPER PIN THAR/HARRIER/SCORPIOS2/AMAZE NEW Brake Caliper,Clutch,₹262,,,0
Pa Ather Back/Rear Disc Plate Motorbike Brake Disc,Clutch,₹832,4.6,(9),9
Mukud Master cylinder FRONT SHAHIN HUNK Xtreem Brake Caliper,Clutch,₹378,,,0
GEO Brake Disc Plate Compatible for Bajaj Pulsar 150/180 Front Brake Disc,Clutch,₹650,3.7,(42),42
TRP Traders REAR BRAKE DISC PLATE - P ULSAR 200 NS / 200 RS Motorbike Brake Disc,Clutch,₹666,4.1,(105),105
road religion Clutch Lever For Royal Enfield NA,Clutch,₹806,,,0
AOWBIKES OLA S1 FRONT DISC PLATE Motorbike Brake Disc,Clutch,₹697,4.4,(51),51
GEO Brake Disc Plate Compatible for Bajaj Pulsar 150 Twin Disc BS6 Motorbike Brake Disc,Clutch,₹597,4,(4),4
GEO Brake Disc Plate Compatible for Bajaj Pulsar F250 Front Brake Disc,Clutch,"₹1,272",,,0
Spoolseal Jcb3dx control valve seal hydro control valve Brake Master Cylinder,Clutch,"₹1,342",,,0
Vtrust FRONT DISC PLATE COMPATIBLE FOR HORNET/ XPULSE 200/ X- BLADE BS6 Motorbike Brake Disc,Clutch,₹782,4.5,(4),4
Pa Front Brake Disc Plate Compatible for Yamaha Cyngus Ray ZR/FASCINO/RAY/RAY ZR/SZ Vehicle Disc Pad,Clutch,₹742,3.7,(3),3
Rock World FRONT Brake Master Cylinder MC Repair Kit Compatible with OLA RIGHT/LEFT Brake Master Cylinder,Clutch,₹270,,,0
GEO SAR S REAR Brake Disc,Clutch,₹726,3.2,(5),5
GEO Brake Disc Plate Compatible for Bajaj Pulsar Pulsar 200/220 Front ABS UG5 Brake Disc,Clutch,₹892,5,(4),4
SELVIKE Front & Rear Disc Brake Plate Compatible with Ola S1 & S1 Pro Motorbike Brake Disc,Clutch,"₹1,821",4,(3),3
Vtrust Rear Disc Brake Plate Compatible for Honda Hornet Motorbike Brake Disc,Clutch,₹789,3.3,(4),4
GEO BAJAJ PLATINA 110 REAR Brake Disc,Clutch,₹684,,,0
GEO Brake Disc Plate Compatible for Bajaj Pulsar AS Front Brake Disc,Clutch,₹748,,,0
"wkm Vacuum Pump VE 115N, Single Stage High Pressure, Capacity of 50 L/min | Brake Vacuum Pump",Clutch,"₹8,742",3.9,(16),16
Pa Gixxer SF Rear Disc Plate Motorbike Brake Disc,Clutch,₹703,4.1,(9),9
Pa CB Hornet Front Disc Plate Vehicle Disc Pad,Clutch,₹853,3.8,(8),8
SHIVTRADRE Fuel Transfer Pump Kit Gasoline Hose Hand Portable Car for Petrol Oil Brake Vacuum Pump,Clutch,₹120,4,(26),26
GEO Disc Plate Compatible with UM Renegade Commando/UM Renegade Sports S/UM Renegade Classic/UM Renegade Mojave Motorbike Brake Disc,Clutch,"₹1,537",,,0
PHANTOM Aluminum Brake Clutch Lever Protector Guard For Universal Bikes Fit Handlebar Hand Guard,Clutch,"₹1,711",,,0
VKHAS Front Disc Brake Plate Ntorq 125cc all model Heavy Duty Motorbike Brake Disc,Clutch,₹612,,,0
"Vtrust Rear Brake Disc Plates, Compatible with TVS Apache RTR 160/180 Motorbike Brake Disc",Clutch,₹724,3.2,(6),6
GEO UNICORN Brake Disc,Clutch,₹880,,,0
GEO Rear Brake Disc Plates Compatible for Hero Glamour Models (Rear) Brake Disc,Clutch,₹938,,,0
CSP jcb 3dx Brake Master Cylinder,Clutch,₹231,3.4,(11),11
Vtrust APACHE Vehicle Disc Pad,Clutch,₹717,3.5,(13),13
Vtrust Rear Disc Brake Plate for Hornet Motorbike Brake Disc,Clutch,₹836,,,0
jop 0899 Brake Caliper,Clutch,₹354,4.3,(110),110
GEO Brake Disc Plate Compatible for Bajaj Platina 11O Brake Disc,Clutch,₹849,2.3,(3),3
GEO Front Brake Disc Plate Compatible With KTM 200/ RC 280MM Brake Disc,Clutch,₹778,2,(4),4
Pa Ktm/Duke Rear Disc Plate Motorbike Brake Disc,Clutch,₹751,4.2,(13),13
TRP Traders Rear Brake Disc Plate Compatible for Yameha R15 V1 Motorbike Brake Disc,Clutch,₹564,5,(11),11
